job_id,job_title,company,location,department,job_level,required_experience_years,required_skills,preferred_certificates,date_posted,job_url,job_description
J0730,Mid-Level Backend Developer,Alex Tech Inc,Mansoura,Software,Mid,9,"C, Docker, Tcp/Ip, Nlp, Javascript",Cisco CCNP,2025-10-08,https//example.com/jobs/130,"Looking for a Mid Backend Developer to join ALEX Tech. Must have experience in C, Docker, TCP/IP. Preferred certification Cisco CCNP."
J0731,Junior Full Stack Developer,Cloudworks Egypt Inc,Tanta,Software,Mid,9,"Pandas, 5G, Nosql, Rest Apis, Terraform, Computer Vision, Node.Js, Kubernetes",Not Specified,2025-10-08,https//example.com/jobs/131,"Looking for a Mid Full Stack Developer to join CloudWorks Egypt. Must have experience in Pandas, 5G, NoSQL. Preferred certification not required."
J0732,Mid-Level Frontend Developer,Futurevision Egypt,Aswan,Software,Junior,5,"Tcp/Ip, Switching, Django, Node.Js, Iso27001, Firewalls, Routing, Kubernetes, React",Certified Information Systems Security Professional (CISSP),2025-10-29,https//example.com/jobs/132,"Looking for a Junior Frontend Developer to join FutureVision. Must have experience in TCP/IP, Switching, Django. Preferred certification Certified Information Systems Security Professional (CISSP)."
J0733,Junior Database Administrator,Cairocloud Solutions,Suez,Data,Mid,1,"Hadoop, Linux, Javascript, React, Numpy",Cisco CCNP,2025-10-23,https//example.com/jobs/133,"Looking for a Mid Database Administrator to join CairoCloud. Must have experience in Hadoop, Linux, JavaScript. Preferred certification Cisco CCNP."
J0734,Mid-Level Data Scientist,Techsol Egypt Solutions,Alexandria,AI,Senior,13,"Tensorflow, React, Azure",Cisco CCNP,2025-10-14,https//example.com/jobs/134,"Looking for a Senior Data Scientist to join TechSol Egypt. Must have experience in TensorFlow, React, Azure. Preferred certification Cisco CCNP."
J0735,Mid-Level Cybersecurity Analyst,Deltabyte Egypt,Cairo,Other,Mid,7,"Computer Vision, Elasticsearch, React, Iso27001, Tensorflow, Sql",Not Specified,2025-10-14,https//example.com/jobs/135,"Looking for a Mid Cybersecurity Analyst to join DeltaByte. Must have experience in Computer Vision, ElasticSearch, React. Preferred certification not required."
J0736,Lead Cybersecurity Analyst,Alex Tech Ltd,Mansoura,Other,Junior,2,"Nosql, Rest Apis, Ansible, Docker, Node.Js",Google Professional Data Engineer,2025-11-18,https//example.com/jobs/136,"Looking for a Junior Cybersecurity Analyst to join ALEX Tech. Must have experience in NoSQL, REST APIs, Ansible. Preferred certification Google Professional Data Engineer."
J0737,Mid-Level Mobile Developer,Nilesoft Solutions,Mansoura,Software,Senior,13,"Tcp/Ip, Rest Apis, Docker, Flask, Sql",Huawei HCIA,2025-11-14,https//example.com/jobs/137,"Looking for a Senior Mobile Developer to join NileSoft. Must have experience in TCP/IP, REST APIs, Docker. Preferred certification Huawei HCIA."
J0738,Mid-Level Frontend Developer,Smartdata Labs Group,Alexandria,Software,Senior,14,"Switching, Nlp, React, Python",Not Specified,2025-10-25,https//example.com/jobs/138,"Looking for a Senior Frontend Developer to join SmartData Labs. Must have experience in Switching, NLP, React. Preferred certification not required."
J0739,Mid-Level Systems Administrator,Pharos Ai Egypt,Alexandria,Network,Senior,7,"Microservices, Aws, Flask, Docker, Tensorflow",Huawei HCIP,2025-11-10,https//example.com/jobs/139,"Looking for a Senior Systems Administrator to join Pharos AI. Must have experience in Microservices, AWS, Flask. Preferred certification Huawei HCIP."
J0740,Mid-Level Product Manager,Techsol Egypt Group,Tanta,Software,Mid,6,"Hipaa, Tensorflow, Node.Js, React, Routing, Numpy, Aws, Docker, Python",Certified Information Systems Security Professional (CISSP),2025-10-24,https//example.com/jobs/140,"Looking for a Mid Product Manager to join TechSol Egypt. Must have experience in HIPAA, TensorFlow, Node.js. Preferred certification Certified Information Systems Security Professional (CISSP)."
J0741,Senior Database Administrator,Cloudworks Egypt Group,Aswan,Data,Senior,8,"Switching, React, Elasticsearch, Ci/Cd",Not Specified,2025-10-13,https//example.com/jobs/141,"Looking for a Senior Database Administrator to join CloudWorks Egypt. Must have experience in Switching, React, ElasticSearch. Preferred certification not required."
J0742,Junior Machine Learning Engineer,Cloudworks Egypt Solutions,Alexandria,AI,Senior,6,"Microservices, Javascript, Flask, Ansible, Pytorch, Routing, Node.Js, Docker",Huawei HCIA,2025-10-01,https//example.com/jobs/142,"Looking for a Senior Machine Learning Engineer to join CloudWorks Egypt. Must have experience in Microservices, JavaScript, Flask. Preferred certification Huawei HCIA."
J0743,Junior Cloud Engineer,Futurevision Egypt,Hurghada,Cloud/DevOps,Junior,4,"Gcp, Docker, Hipaa, Aws, Python",Cisco CCNA,2025-09-29,https//example.com/jobs/143,"Looking for a Junior Cloud Engineer to join FutureVision. Must have experience in GCP, Docker, HIPAA. Preferred certification Cisco CCNA."
J0744,Junior Systems Administrator,Deltabyte Egypt,Giza,Network,Mid,4,"Firewalls, Pytorch, Sql, 5G, C, Java, Node.Js, Python, Aws",AWS Certified Solutions Architect,2025-11-20,https//example.com/jobs/144,"Looking for a Mid Systems Administrator to join DeltaByte. Must have experience in Firewalls, PyTorch, SQL. Preferred certification AWS Certified Solutions Architect."
J0745,Principal Embedded Systems Engineer,Pharos Ai Inc,Hurghada,Network,Senior,10,"Java, Rest Apis, Terraform, Tcp/Ip, Routing, Git, Azure",Google Professional Data Engineer,2025-10-10,https//example.com/jobs/145,"Looking for a Senior Embedded Systems Engineer to join Pharos AI. Must have experience in Java, REST APIs, Terraform. Preferred certification Google Professional Data Engineer."
J0746,Senior Business Analyst,Nilesoft Inc,Cairo,Data,Junior,9,"Ci/Cd, Kubernetes, 5G, Pytorch, Switching, Ansible, React, Node.Js",Cisco CCNP,2025-10-16,https//example.com/jobs/146,"Looking for a Junior Business Analyst to join NileSoft. Must have experience in CI/CD, Kubernetes, 5G. Preferred certification Cisco CCNP."
J0747,Lead Machine Learning Engineer,Cloudworks Egypt Group,Tanta,AI,Mid,4,"Azure, Ci/Cd, Flask, Linux, Elasticsearch, Kubernetes, Sql, Node.Js",Huawei HCIP,2025-09-30,https//example.com/jobs/147,"Looking for a Mid Machine Learning Engineer to join CloudWorks Egypt. Must have experience in Azure, CI/CD, Flask. Preferred certification Huawei HCIP."
J0748,Lead Full Stack Developer,Techsol Egypt Group,Mansoura,Software,Senior,12,"Sql, Switching, Iso27001, Docker",Huawei HCIA,2025-10-22,https//example.com/jobs/148,"Looking for a Senior Full Stack Developer to join TechSol Egypt. Must have experience in SQL, Switching, ISO27001. Preferred certification Huawei HCIA."
J0749,Mid-Level It Support Engineer,Smartdata Labs Solutions,Suez,Cloud/DevOps,Senior,11,"Node.Js, Numpy, Microservices, Kubernetes",Certified Information Systems Security Professional (CISSP),2025-10-06,https//example.com/jobs/149,"Looking for a Senior IT Support Engineer to join SmartData Labs. Must have experience in Node.js, NumPy, Microservices. Preferred certification Certified Information Systems Security Professional (CISSP)."
J0750,Mid-Level Data Analyst,Deltabyte Inc,Tanta,Data,Intern,1,"Rest Apis, Git, Tcp/Ip, Terraform, Python, Docker",AWS Certified Developer,2025-10-18,https//example.com/jobs/150,"Looking for a Intern Data Analyst to join DeltaByte. Must have experience in REST APIs, Git, TCP/IP. Preferred certification AWS Certified Developer."
J0751,Principal Machine Learning Engineer,Pharos Ai Group,Tanta,AI,Senior,9,"Numpy, Javascript, Iso27001",Not Specified,2025-10-03,https//example.com/jobs/151,"Looking for a Senior Machine Learning Engineer to join Pharos AI. Must have experience in NumPy, JavaScript, ISO27001. Preferred certification not required."
J0752,Senior Devops Engineer,Pyramid Solutions Ltd,Mansoura,Cloud/DevOps,Junior,7,"Linux, Flask, Tensorflow, Django, Numpy, Computer Vision, 5G, Kubernetes, Node.Js, React",Not Specified,2025-11-20,https//example.com/jobs/152,"Looking for a Junior DevOps Engineer to join Pyramid Solutions. Must have experience in Linux, Flask, TensorFlow. Preferred certification not required."
J0753,Senior Devops Engineer,Cloudworks Egypt Egypt,Alexandria,Cloud/DevOps,Junior,6,"C, Firewalls, Iso27001, Tensorflow, 5G, Git, Ci/Cd, Docker",Huawei HCIA,2025-10-29,https//example.com/jobs/153,"Looking for a Junior DevOps Engineer to join CloudWorks Egypt. Must have experience in C, Firewalls, ISO27001. Preferred certification Huawei HCIA."
J0754,Lead It Support Engineer,Cairocloud Solutions,Tanta,Cloud/DevOps,Senior,9,"Numpy, Routing, Firewalls, 5G, Docker, Aws, React",Not Specified,2025-11-13,https//example.com/jobs/154,"Looking for a Senior IT Support Engineer to join CairoCloud. Must have experience in NumPy, Routing, Firewalls. Preferred certification not required."
J0755,Junior It Support Engineer,Pyramid Solutions Solutions,Suez,Cloud/DevOps,Senior,8,"Java, Computer Vision, 5G, Flask, Spark, Routing, Node.Js, Tensorflow, Aws",AWS Certified Solutions Architect,2025-10-29,https//example.com/jobs/155,"Looking for a Senior IT Support Engineer to join Pyramid Solutions. Must have experience in Java, Computer Vision, 5G. Preferred certification AWS Certified Solutions Architect."
J0756,Junior Product Manager,Pharos Ai Ltd,Hurghada,Software,Senior,14,"Ansible, Pandas, Pytorch, Azure, Python",AWS Certified Solutions Architect,2025-10-27,https//example.com/jobs/156,"Looking for a Senior Product Manager to join Pharos AI. Must have experience in Ansible, Pandas, PyTorch. Preferred certification AWS Certified Solutions Architect."
J0757,Mid-Level Full Stack Developer,Delta Systems Solutions,Cairo,Software,Mid,8,"Spark, Kubernetes, Microservices, Git, Sql, Node.Js, Python",AWS Certified Solutions Architect,2025-11-05,https//example.com/jobs/157,"Looking for a Mid Full Stack Developer to join Delta Systems. Must have experience in Spark, Kubernetes, Microservices. Preferred certification AWS Certified Solutions Architect."
J0758,Senior Machine Learning Engineer,Pyramid Solutions Group,Hurghada,AI,Mid,8,"Pandas, Switching, Nosql, Ci/Cd, 5G, Nlp, Gcp, Node.Js",Certified Information Systems Security Professional (CISSP),2025-10-03,https//example.com/jobs/158,"Looking for a Mid Machine Learning Engineer to join Pyramid Solutions. Must have experience in Pandas, Switching, NoSQL. Preferred certification Certified Information Systems Security Professional (CISSP)."
J0759,Principal Ai Researcher,Pharos Ai Solutions,Mansoura,AI,Junior,5,"Kubernetes, Rest Apis, Switching, Git, Nlp, Python, Node.Js, Sql",Not Specified,2025-11-19,https//example.com/jobs/159,"Looking for a Junior AI Researcher to join Pharos AI. Must have experience in Kubernetes, REST APIs, Switching. Preferred certification not required."
J0760,Junior Network Engineer,Pharos Ai Solutions,Giza,Network,Mid,6,"Nlp, Pytorch, Tcp/Ip, C, Hipaa, Node.Js",Cisco CCNP,2025-11-19,https//example.com/jobs/160,"Looking for a Mid Network Engineer to join Pharos AI. Must have experience in NLP, PyTorch, TCP/IP. Preferred certification Cisco CCNP."
J0761,Principal Business Analyst,Masrsoft Group,Mansoura,Data,Senior,9,"Terraform, Linux, Hipaa, Tensorflow, Docker, Sql",AWS Certified Developer,2025-10-30,https//example.com/jobs/161,"Looking for a Senior Business Analyst to join MasrSoft. Must have experience in Terraform, Linux, HIPAA. Preferred certification AWS Certified Developer."
J0762,Mid-Level Embedded Systems Engineer,Delta Systems Ltd,Hurghada,Network,Junior,3,"Javascript, Django, Spark, 5G, Node.Js",Certified Information Systems Security Professional (CISSP),2025-09-27,https//example.com/jobs/162,"Looking for a Junior Embedded Systems Engineer to join Delta Systems. Must have experience in JavaScript, Django, Spark. Preferred certification Certified Information Systems Security Professional (CISSP)."
J0763,Senior Machine Learning Engineer,Techsol Egypt Group,Alexandria,AI,Mid,9,"Docker, Tcp/Ip, Switching, Iso27001, Javascript, Node.Js, Python",Huawei HCIP,2025-10-25,https//example.com/jobs/163,"Looking for a Mid Machine Learning Engineer to join TechSol Egypt. Must have experience in Docker, TCP/IP, Switching. Preferred certification Huawei HCIP."
J0764,Lead Backend Developer,Cairocloud Inc,Aswan,Software,Senior,6,"Numpy, Rest Apis, Nosql, Kubernetes",Cisco CCNA,2025-11-16,https//example.com/jobs/164,"Looking for a Senior Backend Developer to join CairoCloud. Must have experience in NumPy, REST APIs, NoSQL. Preferred certification Cisco CCNA."
J0765,Senior Backend Developer,Techsol Egypt Ltd,Mansoura,Software,Mid,1,"Tcp/Ip, Ci/Cd, Terraform, Ansible, Rest Apis, Python, Sql",Huawei HCIA,2025-11-14,https//example.com/jobs/165,"Looking for a Mid Backend Developer to join TechSol Egypt. Must have experience in TCP/IP, CI/CD, Terraform. Preferred certification Huawei HCIA."
J0766,Junior It Support Engineer,Smartdata Labs Group,Mansoura,Cloud/DevOps,Junior,1,"Sql, Ci/Cd, Gcp, Nosql, Python, Node.Js, Kubernetes, Docker",Cisco CCNP,2025-11-10,https//example.com/jobs/166,"Looking for a Junior IT Support Engineer to join SmartData Labs. Must have experience in SQL, CI/CD, GCP. Preferred certification Cisco CCNP."
J0767,Principal Systems Administrator,Deltabyte Group,Hurghada,Network,Junior,9,"Microservices, Switching, Node.Js, Numpy, Django, Nosql, Python, Tensorflow",Huawei HCIA,2025-10-21,https//example.com/jobs/167,"Looking for a Junior Systems Administrator to join DeltaByte. Must have experience in Microservices, Switching, Node.js. Preferred certification Huawei HCIA."
J0768,Mid-Level Cloud Engineer,Delta Systems Egypt,Cairo,Cloud/DevOps,Junior,5,"Linux, 5G, Routing, Python, Gcp, Computer Vision",Huawei HCIP,2025-09-24,https//example.com/jobs/168,"Looking for a Junior Cloud Engineer to join Delta Systems. Must have experience in Linux, 5G, Routing. Preferred certification Huawei HCIP."
J0769,Mid-Level Full Stack Developer,Smartdata Labs Inc,Mansoura,Software,Junior,6,"Tcp/Ip, Computer Vision, Aws, Kubernetes, Node.Js, Docker",Huawei HCIP,2025-09-29,https//example.com/jobs/169,"Looking for a Junior Full Stack Developer to join SmartData Labs. Must have experience in TCP/IP, Computer Vision, AWS. Preferred certification Huawei HCIP."
J0770,Junior Product Manager,Cairocloud Egypt,Suez,Software,Senior,9,"Hipaa, Git, Terraform, Kubernetes, Azure, Node.Js, Tensorflow, Docker",Not Specified,2025-10-19,https//example.com/jobs/170,"Looking for a Senior Product Manager to join CairoCloud. Must have experience in HIPAA, Git, Terraform. Preferred certification not required."
J0771,Principal It Support Engineer,Futurevision Solutions,Tanta,Cloud/DevOps,Junior,2,"Hipaa, Microservices, Docker, Tensorflow, Node.Js, Aws",Not Specified,2025-09-30,https//example.com/jobs/171,"Looking for a Junior IT Support Engineer to join FutureVision. Must have experience in HIPAA, Microservices, Docker. Preferred certification not required."
J0772,Lead Data Scientist,Alex Tech Ltd,Suez,AI,Junior,4,"Rest Apis, Node.Js, Microservices, Elasticsearch, Javascript, Ci/Cd, Tensorflow",Not Specified,2025-10-17,https//example.com/jobs/172,"Looking for a Junior Data Scientist to join ALEX Tech. Must have experience in REST APIs, Node.js, Microservices. Preferred certification not required."
J0773,Junior Business Analyst,Deltabyte Ltd,Cairo,Data,Mid,4,"Numpy, Gcp, Python, Docker, Sql, React",Huawei HCIP,2025-10-28,https//example.com/jobs/173,"Looking for a Mid Business Analyst to join DeltaByte. Must have experience in NumPy, GCP, Python. Preferred certification Huawei HCIP."
J0774,Senior Frontend Developer,Techsol Egypt Egypt,Aswan,Software,Junior,1,"Javascript, React, Git, C, Tcp/Ip, Spark, Nosql, Kubernetes",Huawei HCIA,2025-11-09,https//example.com/jobs/174,"Looking for a Junior Frontend Developer to join TechSol Egypt. Must have experience in JavaScript, React, Git. Preferred certification Huawei HCIA."
J0775,Senior Database Administrator,Alex Tech Group,Aswan,Data,Mid,9,"Node.Js, Terraform, Tensorflow, Nlp, Flask, Nosql, Python",Not Specified,2025-10-16,https//example.com/jobs/175,"Looking for a Mid Database Administrator to join ALEX Tech. Must have experience in Node.js, Terraform, TensorFlow. Preferred certification not required."
J0776,Mid-Level It Support Engineer,Cairocloud Inc,Hurghada,Cloud/DevOps,Senior,4,"Ci/Cd, Terraform, Hadoop, Pandas, Aws, Python",Huawei HCIP,2025-10-20,https//example.com/jobs/176,"Looking for a Senior IT Support Engineer to join CairoCloud. Must have experience in CI/CD, Terraform, Hadoop. Preferred certification Huawei HCIP."
J0777,Junior Devops Engineer,Cairocloud Group,Mansoura,Cloud/DevOps,Junior,1,"Spark, Java, Azure, Node.Js, Tensorflow",Huawei HCIP,2025-09-25,https//example.com/jobs/177,"Looking for a Junior DevOps Engineer to join CairoCloud. Must have experience in Spark, Java, Azure. Preferred certification Huawei HCIP."
J0778,Junior Full Stack Developer,Deltabyte Inc,Cairo,Software,Mid,1,"C, Numpy, Elasticsearch, Aws, React, Python",Not Specified,2025-10-04,https//example.com/jobs/178,"Looking for a Mid Full Stack Developer to join DeltaByte. Must have experience in C, NumPy, ElasticSearch. Preferred certification not required."
J0779,Mid-Level Backend Developer,Cairocloud Egypt,Mansoura,Software,Junior,7,"Switching, Azure, Routing, Pytorch, Ansible, Aws, Spark, Python, Docker, Sql",Cisco CCNA,2025-10-08,https//example.com/jobs/179,"Looking for a Junior Backend Developer to join CairoCloud. Must have experience in Switching, Azure, Routing. Preferred certification Cisco CCNA."
J0780,Lead Backend Developer,Pyramid Solutions Ltd,Alexandria,Software,Mid,7,"Rest Apis, Javascript, Nlp, Pandas, Ansible, Switching, Spark, Node.Js",Google Professional Data Engineer,2025-09-30,https//example.com/jobs/180,"Looking for a Mid Backend Developer to join Pyramid Solutions. Must have experience in REST APIs, JavaScript, NLP. Preferred certification Google Professional Data Engineer."
J0781,Senior Systems Administrator,Giza Networks Ltd,Alexandria,Network,Senior,14,"Aws, Routing, Pytorch, Ci/Cd, Python",AWS Certified Solutions Architect,2025-10-26,https//example.com/jobs/181,"Looking for a Senior Systems Administrator to join Giza Networks. Must have experience in AWS, Routing, PyTorch. Preferred certification AWS Certified Solutions Architect."
J0782,Mid-Level Database Administrator,Giza Networks Group,Alexandria,Data,Mid,5,"5G, Node.Js, Elasticsearch, Computer Vision, Kubernetes",AWS Certified Developer,2025-10-25,https//example.com/jobs/182,"Looking for a Mid Database Administrator to join Giza Networks. Must have experience in 5G, Node.js, ElasticSearch. Preferred certification AWS Certified Developer."
J0783,Principal Data Analyst,Techsol Egypt Egypt,Mansoura,Data,Mid,2,"Docker, Firewalls, Hipaa, Kubernetes, Tensorflow",Huawei HCIP,2025-10-21,https//example.com/jobs/183,"Looking for a Mid Data Analyst to join TechSol Egypt. Must have experience in Docker, Firewalls, HIPAA. Preferred certification Huawei HCIP."
J0784,Principal Data Analyst,Alex Tech Solutions,Mansoura,Data,Lead,5,"Docker, Flask, Git, Azure, Kubernetes",Huawei HCIP,2025-10-16,https//example.com/jobs/184,"Looking for a Lead Data Analyst to join ALEX Tech. Must have experience in Docker, Flask, Git. Preferred certification Huawei HCIP."
J0785,Junior Ai Researcher,Pyramid Solutions Inc,Tanta,AI,Senior,11,"Terraform, Nlp, Routing, Gcp, Computer Vision, Microservices",Certified Information Systems Security Professional (CISSP),2025-10-20,https//example.com/jobs/185,"Looking for a Senior AI Researcher to join Pyramid Solutions. Must have experience in Terraform, NLP, Routing. Preferred certification Certified Information Systems Security Professional (CISSP)."
J0786,Senior Full Stack Developer,Cloudworks Egypt Inc,Suez,Software,Senior,10,"Computer Vision, Switching, Spark, C, Aws",Huawei HCIP,2025-11-07,https//example.com/jobs/186,"Looking for a Senior Full Stack Developer to join CloudWorks Egypt. Must have experience in Computer Vision, Switching, Spark. Preferred certification Huawei HCIP."
J0787,Lead Machine Learning Engineer,Techsol Egypt Solutions,Mansoura,AI,Mid,6,"Pytorch, Docker, 5G, Aws, Pandas, Node.Js, React",Huawei HCIP,2025-10-22,https//example.com/jobs/187,"Looking for a Mid Machine Learning Engineer to join TechSol Egypt. Must have experience in PyTorch, Docker, 5G. Preferred certification Huawei HCIP."
J0788,Lead Mobile Developer,Masrsoft Ltd,Tanta,Software,Junior,10,"Ci/Cd, Sql, Nlp, Iso27001, Tensorflow, Rest Apis, React, Python",Huawei HCIA,2025-11-18,https//example.com/jobs/188,"Looking for a Junior Mobile Developer to join MasrSoft. Must have experience in CI/CD, SQL, NLP. Preferred certification Huawei HCIA."
J0789,Mid-Level Mobile Developer,Masrsoft Ltd,Cairo,Software,Mid,3,"Python, Spark, Tensorflow, Aws",Huawei HCIP,2025-09-25,https//example.com/jobs/189,"Looking for a Mid Mobile Developer to join MasrSoft. Must have experience in Python, Spark, TensorFlow. Preferred certification Huawei HCIP."
J0790,Lead Machine Learning Engineer,Techsol Egypt Group,Hurghada,AI,Mid,7,"Git, Rest Apis, Java, Node.Js, Sql, Python",AWS Certified Solutions Architect,2025-10-25,https//example.com/jobs/190,"Looking for a Mid Machine Learning Engineer to join TechSol Egypt. Must have experience in Git, REST APIs, Java. Preferred certification AWS Certified Solutions Architect."
J0791,Junior Mobile Developer,Giza Networks Group,Cairo,Software,Intern,0,"Terraform, Tcp/Ip, Java, Microservices, Hadoop",Huawei HCIA,2025-09-27,https//example.com/jobs/191,"Looking for a Intern Mobile Developer to join Giza Networks. Must have experience in Terraform, TCP/IP, Java. Preferred certification Huawei HCIA."
J0792,Principal Full Stack Developer,Pyramid Solutions Group,Alexandria,Software,Junior,6,"Linux, Numpy, Node.Js, Computer Vision, Ci/Cd, Docker, React",Huawei HCIP,2025-11-04,https//example.com/jobs/192,"Looking for a Junior Full Stack Developer to join Pyramid Solutions. Must have experience in Linux, NumPy, Node.js. Preferred certification Huawei HCIP."
J0793,Mid-Level Ai Researcher,Pharos Ai Ltd,Giza,AI,Mid,2,"Numpy, Pandas, Hipaa, React, Python, Node.Js",Certified Information Systems Security Professional (CISSP),2025-09-24,https//example.com/jobs/193,"Looking for a Mid AI Researcher to join Pharos AI. Must have experience in NumPy, Pandas, HIPAA. Preferred certification Certified Information Systems Security Professional (CISSP)."
J0794,Senior Software Engineer,Futurevision Group,Alexandria,Software,Junior,9,"Iso27001, Django, Ansible, C, Aws, Kubernetes",Huawei HCIP,2025-11-17,https//example.com/jobs/194,"Looking for a Junior Software Engineer to join FutureVision. Must have experience in ISO27001, Django, Ansible. Preferred certification Huawei HCIP."
J0795,Principal Embedded Systems Engineer,Smartdata Labs Group,Mansoura,Network,Intern,0,"Linux, Terraform, Iso27001",AWS Certified Solutions Architect,2025-10-02,https//example.com/jobs/195,"Looking for a Intern Embedded Systems Engineer to join SmartData Labs. Must have experience in Linux, Terraform, ISO27001. Preferred certification AWS Certified Solutions Architect."
J0796,Mid-Level Cloud Engineer,Techsol Egypt Inc,Hurghada,Cloud/DevOps,Mid,9,"Routing, Sql, Iso27001, React, Docker",Huawei HCIP,2025-10-27,https//example.com/jobs/196,"Looking for a Mid Cloud Engineer to join TechSol Egypt. Must have experience in Routing, SQL, ISO27001. Preferred certification Huawei HCIP."
J0797,Lead Cybersecurity Analyst,Masrsoft Inc,Tanta,Other,Mid,5,"Microservices, Nlp, Javascript, Node.Js, Python",AWS Certified Developer,2025-10-18,https//example.com/jobs/197,"Looking for a Mid Cybersecurity Analyst to join MasrSoft. Must have experience in Microservices, NLP, JavaScript. Preferred certification AWS Certified Developer."
J0798,Lead Ai Researcher,Nilesoft Ltd,Tanta,AI,Mid,8,"Java, Linux, Elasticsearch, Rest Apis, Aws",Cisco CCNP,2025-10-26,https//example.com/jobs/198,"Looking for a Mid AI Researcher to join NileSoft. Must have experience in Java, Linux, ElasticSearch. Preferred certification Cisco CCNP."
J0799,Mid-Level Cybersecurity Analyst,Giza Networks Ltd,Alexandria,Other,Mid,9,"Tcp/Ip, Azure, React, Aws, Node.Js, Python",AWS Certified Developer,2025-10-08,https//example.com/jobs/199,"Looking for a Mid Cybersecurity Analyst to join Giza Networks. Must have experience in TCP/IP, Azure, React. Preferred certification AWS Certified Developer."
J0800,Senior Machine Learning Engineer,Giza Networks Inc,Alexandria,AI,Senior,10,"Django, Node.Js, Python, Routing, Elasticsearch, Docker",Cisco CCNP,2025-11-08,https//example.com/jobs/200,"Looking for a Senior Machine Learning Engineer to join Giza Networks. Must have experience in Django, Node.js, Python. Preferred certification Cisco CCNP."
J0801,Senior Network Engineer,Nilesoft Ltd,Alexandria,Network,Junior,7,"Hipaa, Firewalls, Microservices, Spark, Django, Java",AWS Certified Developer,2025-10-13,https//example.com/jobs/201,"Looking for a Junior Network Engineer to join NileSoft. Must have experience in HIPAA, Firewalls, Microservices. Preferred certification AWS Certified Developer."
J0802,Senior Mobile Developer,Nilesoft Group,Tanta,Software,Senior,7,"Spark, Pandas, Node.Js, Hipaa, Azure, Docker",Not Specified,2025-10-01,https//example.com/jobs/202,"Looking for a Senior Mobile Developer to join NileSoft. Must have experience in Spark, Pandas, Node.js. Preferred certification not required."
J0803,Lead Cybersecurity Analyst,Cairocloud Solutions,Alexandria,Other,Junior,5,"Pytorch, React, Sql, Hadoop, Linux, Spark, Aws, Docker",Cisco CCNA,2025-10-21,https//example.com/jobs/203,"Looking for a Junior Cybersecurity Analyst to join CairoCloud. Must have experience in PyTorch, React, SQL. Preferred certification Cisco CCNA."
