job_id,job_title,company,location,department,job_level,required_experience_years,required_skills,preferred_certificates,date_posted,job_url,job_description
J1094,Senior Software Engineer,Futurevision Egypt,Alexandria,Software,Junior,6,"Iso27001, Django, Ansible, C, Aws, Docker",Huawei HCIP,2025-11-17,https//example.com/jobs/194,"Looking for a Junior Software Engineer to join FutureVision. Must have experience in ISO27001, Django, Ansible. Preferred certification Huawei HCIP."
J1095,Junior Embedded Systems Engineer,Smartdata Labs Inc,Mansoura,Network,Intern,1,"Linux, Terraform, Iso27001, Python",AWS Certified Solutions Architect,2025-10-02,https//example.com/jobs/195,"Looking for a Intern Embedded Systems Engineer to join SmartData Labs. Must have experience in Linux, Terraform, ISO27001. Preferred certification AWS Certified Solutions Architect."
J1096,Principal Cloud Engineer,Techsol Egypt Group,Hurghada,Cloud/DevOps,Mid,6,"Routing, Sql, Iso27001, Kubernetes, Docker, Tensorflow",Huawei HCIP,2025-10-27,https//example.com/jobs/196,"Looking for a Mid Cloud Engineer to join TechSol Egypt. Must have experience in Routing, SQL, ISO27001. Preferred certification Huawei HCIP."
J1097,Principal Cybersecurity Analyst,Masrsoft Ltd,Tanta,Other,Mid,3,"Microservices, Nlp, Javascript, Aws, Docker, Python",AWS Certified Developer,2025-10-18,https//example.com/jobs/197,"Looking for a Mid Cybersecurity Analyst to join MasrSoft. Must have experience in Microservices, NLP, JavaScript. Preferred certification AWS Certified Developer."
J1098,Mid-Level Ai Researcher,Nilesoft Inc,Tanta,AI,Mid,9,"Java, Linux, Elasticsearch, Rest Apis, Aws, Docker",Cisco CCNP,2025-10-26,https//example.com/jobs/198,"Looking for a Mid AI Researcher to join NileSoft. Must have experience in Java, Linux, ElasticSearch. Preferred certification Cisco CCNP."
J1099,Lead Cybersecurity Analyst,Giza Networks Solutions,Alexandria,Other,Mid,9,"Tcp/Ip, Azure, React, Kubernetes, Python",AWS Certified Developer,2025-10-08,https//example.com/jobs/199,"Looking for a Mid Cybersecurity Analyst to join Giza Networks. Must have experience in TCP/IP, Azure, React. Preferred certification AWS Certified Developer."
J1100,Senior Machine Learning Engineer,Giza Networks Solutions,Alexandria,AI,Senior,10,"Django, Node.Js, Python, Routing, Elasticsearch",Cisco CCNP,2025-11-08,https//example.com/jobs/200,"Looking for a Senior Machine Learning Engineer to join Giza Networks. Must have experience in Django, Node.js, Python. Preferred certification Cisco CCNP."
J1101,Junior Network Engineer,Nilesoft Solutions,Alexandria,Network,Junior,8,"Hipaa, Firewalls, Microservices, Spark, Django, Java",AWS Certified Developer,2025-10-13,https//example.com/jobs/201,"Looking for a Junior Network Engineer to join NileSoft. Must have experience in HIPAA, Firewalls, Microservices. Preferred certification AWS Certified Developer."
J1102,Lead Mobile Developer,Nilesoft Ltd,Tanta,Software,Senior,7,"Spark, Pandas, Node.Js, Hipaa, Azure, Sql, Tensorflow, Docker",Not Specified,2025-10-01,https//example.com/jobs/202,"Looking for a Senior Mobile Developer to join NileSoft. Must have experience in Spark, Pandas, Node.js. Preferred certification not required."
J1103,Senior Cybersecurity Analyst,Cairocloud Group,Alexandria,Other,Junior,4,"Pytorch, React, Sql, Hadoop, Linux, Spark",Cisco CCNA,2025-10-21,https//example.com/jobs/203,"Looking for a Junior Cybersecurity Analyst to join CairoCloud. Must have experience in PyTorch, React, SQL. Preferred certification Cisco CCNA."
J1104,Junior Frontend Developer,Alex Tech Inc,Mansoura,Software,Senior,11,"Docker, Ci/Cd, Django, Tensorflow, Routing, Python, Numpy, Sql, Aws",Cisco CCNP,2025-11-13,https//example.com/jobs/204,"Looking for a Senior Frontend Developer to join ALEX Tech. Must have experience in Docker, CI/CD, Django. Preferred certification Cisco CCNP."
J1105,Principal Quality Assurance Engineer,Giza Networks Ltd,Tanta,Software,Mid,6,"Tensorflow, Routing, Switching, Docker, Git, Hipaa, Nosql",Google Professional Data Engineer,2025-10-11,https//example.com/jobs/205,"Looking for a Mid Quality Assurance Engineer to join Giza Networks. Must have experience in TensorFlow, Routing, Switching. Preferred certification Google Professional Data Engineer."
J1106,Junior Systems Administrator,Futurevision Solutions,Suez,Network,Lead,8,"Pandas, Linux, Numpy, Computer Vision, Flask, React, Kubernetes, Docker",Huawei HCIP,2025-10-28,https//example.com/jobs/206,"Looking for a Lead Systems Administrator to join FutureVision. Must have experience in Pandas, Linux, NumPy. Preferred certification Huawei HCIP."
J1107,Principal Mobile Developer,Cairocloud Inc,Cairo,Software,Lead,11,"Elasticsearch, Tcp/Ip, React, Spark, Aws, Tensorflow, Python",Certified Information Systems Security Professional (CISSP),2025-09-29,https//example.com/jobs/207,"Looking for a Lead Mobile Developer to join CairoCloud. Must have experience in ElasticSearch, TCP/IP, React. Preferred certification Certified Information Systems Security Professional (CISSP)."
J1108,Lead Systems Administrator,Delta Systems Solutions,Mansoura,Network,Mid,9,"React, Elasticsearch, Git, Numpy, Microservices, Spark, Node.Js, Kubernetes",Not Specified,2025-09-23,https//example.com/jobs/208,"Looking for a Mid Systems Administrator to join Delta Systems. Must have experience in React, ElasticSearch, Git. Preferred certification not required."
J1109,Lead Devops Engineer,Futurevision Group,Giza,Cloud/DevOps,Junior,5,"Sql, C, Iso27001, Numpy, 5G, Python",Google Professional Data Engineer,2025-09-27,https//example.com/jobs/209,"Looking for a Junior DevOps Engineer to join FutureVision. Must have experience in SQL, C, ISO27001. Preferred certification Google Professional Data Engineer."
J1110,Junior Software Engineer,Nilesoft Solutions,Mansoura,Software,Junior,5,"Computer Vision, Numpy, Ci/Cd, Microservices, Pytorch, Nlp, React",AWS Certified Solutions Architect,2025-10-21,https//example.com/jobs/210,"Looking for a Junior Software Engineer to join NileSoft. Must have experience in Computer Vision, NumPy, CI/CD. Preferred certification AWS Certified Solutions Architect."
J1111,Mid-Level Full Stack Developer,Pharos Ai Inc,Aswan,Software,Senior,8,"Pytorch, Nlp, Routing, Sql",Cisco CCNP,2025-10-20,https//example.com/jobs/211,"Looking for a Senior Full Stack Developer to join Pharos AI. Must have experience in PyTorch, NLP, Routing. Preferred certification Cisco CCNP."
J1112,Junior Data Analyst,Pyramid Solutions Ltd,Suez,Data,Junior,2,"Elasticsearch, Switching, React, Routing, C, Flask, Sql, Docker, Kubernetes",AWS Certified Solutions Architect,2025-11-14,https//example.com/jobs/212,"Looking for a Junior Data Analyst to join Pyramid Solutions. Must have experience in ElasticSearch, Switching, React. Preferred certification AWS Certified Solutions Architect."
J1113,Senior Cloud Engineer,Masrsoft Solutions,Giza,Cloud/DevOps,Mid,2,"Ansible, Nosql, Hipaa, Sql",Cisco CCNP,2025-10-26,https//example.com/jobs/213,"Looking for a Mid Cloud Engineer to join MasrSoft. Must have experience in Ansible, NoSQL, HIPAA. Preferred certification Cisco CCNP."
J1114,Mid-Level Database Administrator,Smartdata Labs Egypt,Hurghada,Data,Senior,7,"Hadoop, Numpy, Java, Docker, Kubernetes, Node.Js, React",Certified Information Systems Security Professional (CISSP),2025-10-28,https//example.com/jobs/214,"Looking for a Senior Database Administrator to join SmartData Labs. Must have experience in Hadoop, NumPy, Java. Preferred certification Certified Information Systems Security Professional (CISSP)."
J1115,Senior Database Administrator,Giza Networks Group,Cairo,Data,Senior,7,"React, Iso27001, Django, Terraform, Nosql, Kubernetes",Cisco CCNP,2025-10-11,https//example.com/jobs/215,"Looking for a Senior Database Administrator to join Giza Networks. Must have experience in React, ISO27001, Django. Preferred certification Cisco CCNP."
J1116,Senior Data Analyst,Smartdata Labs Ltd,Giza,Data,Junior,7,"Switching, Pandas, Numpy, Flask, Nlp, Ansible, Ci/Cd",Huawei HCIA,2025-11-12,https//example.com/jobs/216,"Looking for a Junior Data Analyst to join SmartData Labs. Must have experience in Switching, Pandas, NumPy. Preferred certification Huawei HCIA."
J1117,Lead Systems Administrator,Deltabyte Ltd,Giza,Network,Mid,5,"Azure, Routing, Flask",Huawei HCIA,2025-10-14,https//example.com/jobs/217,"Looking for a Mid Systems Administrator to join DeltaByte. Must have experience in Azure, Routing, Flask. Preferred certification Huawei HCIA."
J1118,Senior Machine Learning Engineer,Pyramid Solutions Inc,Aswan,AI,Mid,3,"Pandas, Hadoop, Nosql, Rest Apis, Hipaa, Sql, Terraform, Kubernetes, Node.Js",Cisco CCNA,2025-09-29,https//example.com/jobs/218,"Looking for a Mid Machine Learning Engineer to join Pyramid Solutions. Must have experience in Pandas, Hadoop, NoSQL. Preferred certification Cisco CCNA."
J1119,Mid-Level Data Scientist,Alex Tech Solutions,Suez,AI,Mid,7,"Rest Apis, Tensorflow, Docker, Kubernetes, React",Google Professional Data Engineer,2025-10-26,https//example.com/jobs/219,"Looking for a Mid Data Scientist to join ALEX Tech. Must have experience in REST APIs, TensorFlow, Docker. Preferred certification Google Professional Data Engineer."
J1120,Junior It Support Engineer,Masrsoft Group,Suez,Cloud/DevOps,Mid,7,"Elasticsearch, Rest Apis, Sql, Node.Js, Java, Aws",Cisco CCNA,2025-09-23,https//example.com/jobs/220,"Looking for a Mid IT Support Engineer to join MasrSoft. Must have experience in ElasticSearch, REST APIs, SQL. Preferred certification Cisco CCNA."
J1121,Junior Network Engineer,Delta Systems Group,Mansoura,Network,Junior,7,"Rest Apis, Hipaa, Microservices, Flask, Terraform, Linux, Computer Vision, Sql, Tensorflow",Not Specified,2025-11-12,https//example.com/jobs/221,"Looking for a Junior Network Engineer to join Delta Systems. Must have experience in REST APIs, HIPAA, Microservices. Preferred certification not required."
J1122,Senior Backend Developer,Cloudworks Egypt Inc,Suez,Software,Mid,6,"Azure, Routing, C",Certified Information Systems Security Professional (CISSP),2025-10-07,https//example.com/jobs/222,"Looking for a Mid Backend Developer to join CloudWorks Egypt. Must have experience in Azure, Routing, C. Preferred certification Certified Information Systems Security Professional (CISSP)."
J1123,Mid-Level Devops Engineer,Nilesoft Egypt,Suez,Cloud/DevOps,Senior,7,"Kubernetes, Firewalls, Nlp, Hadoop",Huawei HCIA,2025-10-30,https//example.com/jobs/223,"Looking for a Senior DevOps Engineer to join NileSoft. Must have experience in Kubernetes, Firewalls, NLP. Preferred certification Huawei HCIA."
J1124,Lead Machine Learning Engineer,Cloudworks Egypt Egypt,Hurghada,AI,Senior,5,"Nlp, Terraform, Linux, Iso27001, Sql, Switching, Tcp/Ip, Node.Js",Cisco CCNA,2025-10-27,https//example.com/jobs/224,"Looking for a Senior Machine Learning Engineer to join CloudWorks Egypt. Must have experience in NLP, Terraform, Linux. Preferred certification Cisco CCNA."
J1125,Senior Network Engineer,Pyramid Solutions Ltd,Giza,Network,Junior,6,"Linux, Tensorflow, Azure, React, Aws",Huawei HCIA,2025-11-05,https//example.com/jobs/225,"Looking for a Junior Network Engineer to join Pyramid Solutions. Must have experience in Linux, TensorFlow, Azure. Preferred certification Huawei HCIA."
J1126,Senior Cloud Engineer,Delta Systems Inc,Aswan,Cloud/DevOps,Mid,6,"Pandas, Elasticsearch, React, Node.Js, Numpy, Microservices, Python",Cisco CCNA,2025-11-04,https//example.com/jobs/226,"Looking for a Mid Cloud Engineer to join Delta Systems. Must have experience in Pandas, ElasticSearch, React. Preferred certification Cisco CCNA."
J1127,Lead Devops Engineer,Smartdata Labs Egypt,Suez,Cloud/DevOps,Junior,3,"Ci/Cd, Nlp, React, Sql, Docker, Node.Js",Not Specified,2025-10-16,https//example.com/jobs/227,"Looking for a Junior DevOps Engineer to join SmartData Labs. Must have experience in CI/CD, NLP, React. Preferred certification not required."
J1128,Mid-Level Data Analyst,Giza Networks Ltd,Hurghada,Data,Mid,6,"5G, Hipaa, Iso27001, Tensorflow, Rest Apis",Cisco CCNP,2025-11-17,https//example.com/jobs/228,"Looking for a Mid Data Analyst to join Giza Networks. Must have experience in 5G, HIPAA, ISO27001. Preferred certification Cisco CCNP."
J1129,Senior Backend Developer,Techsol Egypt Solutions,Giza,Software,Mid,7,"Flask, Sql, Elasticsearch, Node.Js, Kubernetes",Certified Information Systems Security Professional (CISSP),2025-09-21,https//example.com/jobs/229,"Looking for a Mid Backend Developer to join TechSol Egypt. Must have experience in Flask, SQL, ElasticSearch. Preferred certification Certified Information Systems Security Professional (CISSP)."
J1130,Principal Database Administrator,Delta Systems Group,Alexandria,Data,Senior,10,"Linux, Node.Js, Computer Vision, Gcp, Docker, Kubernetes, Sql",AWS Certified Developer,2025-10-14,https//example.com/jobs/230,"Looking for a Senior Database Administrator to join Delta Systems. Must have experience in Linux, Node.js, Computer Vision. Preferred certification AWS Certified Developer."
J1131,Principal Data Scientist,Techsol Egypt Group,Aswan,AI,Mid,6,"Node.Js, Django, Python, Kubernetes, Git, React, Aws",Huawei HCIA,2025-10-28,https//example.com/jobs/231,"Looking for a Mid Data Scientist to join TechSol Egypt. Must have experience in Node.js, Django, Python. Preferred certification Huawei HCIA."
J1132,Lead Ai Researcher,Pyramid Solutions Egypt,Suez,AI,Intern,0,"Flask, Hadoop, Tensorflow, Git, React",Huawei HCIP,2025-10-15,https//example.com/jobs/232,"Looking for a Intern AI Researcher to join Pyramid Solutions. Must have experience in Flask, Hadoop, TensorFlow. Preferred certification Huawei HCIP."
J1133,Lead Frontend Developer,Futurevision Group,Giza,Software,Junior,8,"Tensorflow, Pandas, Pytorch, React, Ansible",AWS Certified Solutions Architect,2025-10-30,https//example.com/jobs/233,"Looking for a Junior Frontend Developer to join FutureVision. Must have experience in TensorFlow, Pandas, PyTorch. Preferred certification AWS Certified Solutions Architect."
J1134,Mid-Level Data Scientist,Smartdata Labs Solutions,Tanta,AI,Senior,7,"Elasticsearch, Kubernetes, Node.Js, Django, Tensorflow, Flask",Google Professional Data Engineer,2025-10-13,https//example.com/jobs/234,"Looking for a Senior Data Scientist to join SmartData Labs. Must have experience in ElasticSearch, Kubernetes, Node.js. Preferred certification Google Professional Data Engineer."
J1135,Junior Database Administrator,Alex Tech Ltd,Alexandria,Data,Junior,3,"Hipaa, Tcp/Ip, Java, Routing",Huawei HCIP,2025-10-24,https//example.com/jobs/235,"Looking for a Junior Database Administrator to join ALEX Tech. Must have experience in HIPAA, TCP/IP, Java. Preferred certification Huawei HCIP."
J1136,Junior Quality Assurance Engineer,Pyramid Solutions Ltd,Hurghada,Software,Senior,10,"Azure, Rest Apis, Pandas",AWS Certified Developer,2025-10-06,https//example.com/jobs/236,"Looking for a Senior Quality Assurance Engineer to join Pyramid Solutions. Must have experience in Azure, REST APIs, Pandas. Preferred certification AWS Certified Developer."
J1137,Senior Product Manager,Masrsoft Ltd,Giza,Software,Mid,0,"Switching, Tensorflow, Pandas, Iso27001, Spark, Docker",Cisco CCNP,2025-10-25,https//example.com/jobs/237,"Looking for a Mid Product Manager to join MasrSoft. Must have experience in Switching, TensorFlow, Pandas. Preferred certification Cisco CCNP."
J1138,Principal Data Scientist,Cloudworks Egypt Ltd,Suez,AI,Lead,7,"Firewalls, React, Python, Sql",Cisco CCNA,2025-10-04,https//example.com/jobs/238,"Looking for a Lead Data Scientist to join CloudWorks Egypt. Must have experience in Firewalls, React, Python. Preferred certification Cisco CCNA."
J1139,Mid-Level Backend Developer,Techsol Egypt Egypt,Aswan,Software,Mid,8,"Numpy, Node.Js, Terraform, Hipaa, Pytorch, Linux, Kubernetes, Sql, Python",AWS Certified Developer,2025-10-10,https//example.com/jobs/239,"Looking for a Mid Backend Developer to join TechSol Egypt. Must have experience in NumPy, Node.js, Terraform. Preferred certification AWS Certified Developer."
J1140,Senior Frontend Developer,Pyramid Solutions Egypt,Hurghada,Software,Lead,6,"Switching, Numpy, React, Routing, Hadoop, Azure, Javascript, Node.Js, Docker, Aws",Huawei HCIP,2025-09-26,https//example.com/jobs/240,"Looking for a Lead Frontend Developer to join Pyramid Solutions. Must have experience in Switching, NumPy, React. Preferred certification Huawei HCIP."
J1141,Senior Database Administrator,Nilesoft Solutions,Suez,Data,Mid,2,"Nosql, Flask, Python, Tensorflow, Sql, Kubernetes",Certified Information Systems Security Professional (CISSP),2025-11-20,https//example.com/jobs/241,"Looking for a Mid Database Administrator to join NileSoft. Must have experience in NoSQL, Flask, Python. Preferred certification Certified Information Systems Security Professional (CISSP)."
J1142,Senior Devops Engineer,Pyramid Solutions Ltd,Mansoura,Cloud/DevOps,Junior,4,"Flask, Java, 5G, Hadoop, Linux",Not Specified,2025-09-25,https//example.com/jobs/242,"Looking for a Junior DevOps Engineer to join Pyramid Solutions. Must have experience in Flask, Java, 5G. Preferred certification not required."
J1143,Senior Network Engineer,Futurevision Group,Giza,Network,Mid,8,"Rest Apis, Iso27001, Sql, Kubernetes, Aws",Cisco CCNP,2025-10-01,https//example.com/jobs/243,"Looking for a Mid Network Engineer to join FutureVision. Must have experience in REST APIs, ISO27001, SQL. Preferred certification Cisco CCNP."
J1144,Mid-Level Network Engineer,Cloudworks Egypt Group,Giza,Network,Senior,8,"Microservices, Python, C, Azure, React, Tensorflow",AWS Certified Solutions Architect,2025-10-21,https//example.com/jobs/244,"Looking for a Senior Network Engineer to join CloudWorks Egypt. Must have experience in Microservices, Python, C. Preferred certification AWS Certified Solutions Architect."
J1145,Senior Devops Engineer,Giza Networks Ltd,Alexandria,Cloud/DevOps,Junior,0,"Spark, Aws, Switching, Azure, Firewalls, Hipaa, Linux, Kubernetes",AWS Certified Developer,2025-10-27,https//example.com/jobs/245,"Looking for a Junior DevOps Engineer to join Giza Networks. Must have experience in Spark, AWS, Switching. Preferred certification AWS Certified Developer."
J1146,Senior Devops Engineer,Nilesoft Egypt,Cairo,Cloud/DevOps,Junior,0,"React, Ci/Cd, Tcp/Ip, Routing, Switching, Node.Js, Tensorflow, Python, Kubernetes",Not Specified,2025-10-20,https//example.com/jobs/246,"Looking for a Junior DevOps Engineer to join NileSoft. Must have experience in React, CI/CD, TCP/IP. Preferred certification not required."
J1147,Principal Software Engineer,Alex Tech Ltd,Hurghada,Software,Junior,5,"Azure, Ci/Cd, Computer Vision, Rest Apis, Docker, Firewalls, Pytorch, Node.Js, React",AWS Certified Solutions Architect,2025-11-19,https//example.com/jobs/247,"Looking for a Junior Software Engineer to join ALEX Tech. Must have experience in Azure, CI/CD, Computer Vision. Preferred certification AWS Certified Solutions Architect."
J1148,Mid-Level Database Administrator,Techsol Egypt Solutions,Hurghada,Data,Mid,1,"Python, Pandas, Routing, Django, Kubernetes",Not Specified,2025-10-06,https//example.com/jobs/248,"Looking for a Mid Database Administrator to join TechSol Egypt. Must have experience in Python, Pandas, Routing. Preferred certification not required."
J1149,Principal Database Administrator,Smartdata Labs Inc,Cairo,Data,Lead,6,"Node.Js, C, Aws, Ansible, Spark",Cisco CCNP,2025-10-20,https//example.com/jobs/249,"Looking for a Lead Database Administrator to join SmartData Labs. Must have experience in Node.js, C, AWS. Preferred certification Cisco CCNP."
J1150,Senior Frontend Developer,Deltabyte Ltd,Giza,Software,Mid,6,"Firewalls, Iso27001, Javascript, Python, Tensorflow, Docker",Google Professional Data Engineer,2025-11-02,https//example.com/jobs/250,"Looking for a Mid Frontend Developer to join DeltaByte. Must have experience in Firewalls, ISO27001, JavaScript. Preferred certification Google Professional Data Engineer."
J1151,Mid-Level Machine Learning Engineer,Delta Systems Egypt,Mansoura,AI,Junior,6,"Switching, Firewalls, Elasticsearch, Linux, Aws, React",Huawei HCIP,2025-09-29,https//example.com/jobs/251,"Looking for a Junior Machine Learning Engineer to join Delta Systems. Must have experience in Switching, Firewalls, ElasticSearch. Preferred certification Huawei HCIP."
J1152,Lead Embedded Systems Engineer,Nilesoft Group,Alexandria,Network,Junior,9,"Switching, Spark, Flask, Terraform, Nlp, Kubernetes",Certified Information Systems Security Professional (CISSP),2025-10-10,https//example.com/jobs/252,"Looking for a Junior Embedded Systems Engineer to join NileSoft. Must have experience in Switching, Spark, Flask. Preferred certification Certified Information Systems Security Professional (CISSP)."
J1153,Lead Business Analyst,Pharos Ai Group,Giza,Data,Junior,7,"C, Kubernetes, Switching, Pytorch, Node.Js, Azure, Nlp, React, Sql",Google Professional Data Engineer,2025-10-23,https//example.com/jobs/253,"Looking for a Junior Business Analyst to join Pharos AI. Must have experience in C, Kubernetes, Switching. Preferred certification Google Professional Data Engineer."
J1154,Junior Backend Developer,Masrsoft Inc,Mansoura,Software,Junior,4,"Numpy, Elasticsearch, Hipaa, Node.Js, Docker, Sql",Not Specified,2025-10-06,https//example.com/jobs/254,"Looking for a Junior Backend Developer to join MasrSoft. Must have experience in NumPy, ElasticSearch, HIPAA. Preferred certification not required."
J1155,Junior Full Stack Developer,Smartdata Labs Inc,Giza,Software,Senior,6,"Python, Javascript, Aws, Kubernetes, Sql",Huawei HCIA,2025-10-03,https//example.com/jobs/255,"Looking for a Senior Full Stack Developer to join SmartData Labs. Must have experience in Python, JavaScript, AWS. Preferred certification Huawei HCIA."
J1156,Junior Cybersecurity Analyst,Alex Tech Group,Giza,Other,Mid,5,"Java, React, Docker",Certified Information Systems Security Professional (CISSP),2025-11-11,https//example.com/jobs/256,"Looking for a Mid Cybersecurity Analyst to join ALEX Tech. Must have experience in Java, React, Docker. Preferred certification Certified Information Systems Security Professional (CISSP)."
J1157,Senior Machine Learning Engineer,Nilesoft Group,Tanta,AI,Junior,8,"Sql, Iso27001, Hadoop, Kubernetes, Docker",Google Professional Data Engineer,2025-10-22,https//example.com/jobs/257,"Looking for a Junior Machine Learning Engineer to join NileSoft. Must have experience in SQL, ISO27001, Hadoop. Preferred certification Google Professional Data Engineer."
J1158,Principal Software Engineer,Giza Networks Egypt,Aswan,Software,Junior,6,"Linux, Elasticsearch, Pytorch, C, Aws, Python, Tensorflow",Huawei HCIP,2025-11-01,https//example.com/jobs/258,"Looking for a Junior Software Engineer to join Giza Networks. Must have experience in Linux, ElasticSearch, PyTorch. Preferred certification Huawei HCIP."
J1159,Junior Systems Administrator,Smartdata Labs Inc,Aswan,Network,Senior,13,"Node.Js, Linux, Pandas, Docker, Tensorflow, React",Huawei HCIA,2025-10-17,https//example.com/jobs/259,"Looking for a Senior Systems Administrator to join SmartData Labs. Must have experience in Node.js, Linux, Pandas. Preferred certification Huawei HCIA."
J1160,Principal Data Analyst,Masrsoft Solutions,Hurghada,Data,Mid,1,"Nlp, Git, Terraform, Rest Apis, Firewalls, Microservices, Kubernetes, Tensorflow",Cisco CCNP,2025-10-15,https//example.com/jobs/260,"Looking for a Mid Data Analyst to join MasrSoft. Must have experience in NLP, Git, Terraform. Preferred certification Cisco CCNP."
J1161,Lead Network Engineer,Cairocloud Solutions,Cairo,Network,Junior,4,"Linux, Javascript, Git, Kubernetes, React, Aws",Not Specified,2025-10-13,https//example.com/jobs/261,"Looking for a Junior Network Engineer to join CairoCloud. Must have experience in Linux, JavaScript, Git. Preferred certification not required."
J1162,Senior Embedded Systems Engineer,Delta Systems Group,Alexandria,Network,Junior,3,"Terraform, Javascript, Aws, Iso27001, Pandas, React",Cisco CCNP,2025-11-19,https//example.com/jobs/262,"Looking for a Junior Embedded Systems Engineer to join Delta Systems. Must have experience in Terraform, JavaScript, AWS. Preferred certification Cisco CCNP."
J1163,Mid-Level Data Scientist,Cairocloud Solutions,Hurghada,AI,Mid,5,"Java, Nlp, Pytorch, Docker, Rest Apis, Routing, Nosql, Kubernetes, Aws, Python",Certified Information Systems Security Professional (CISSP),2025-09-23,https//example.com/jobs/263,"Looking for a Mid Data Scientist to join CairoCloud. Must have experience in Java, NLP, PyTorch. Preferred certification Certified Information Systems Security Professional (CISSP)."
J1164,Principal Frontend Developer,Techsol Egypt Egypt,Hurghada,Software,Mid,2,"Git, Python, 5G, Docker, Tensorflow, Hipaa, Nosql, Sql, Aws",Cisco CCNP,2025-09-24,https//example.com/jobs/264,"Looking for a Mid Frontend Developer to join TechSol Egypt. Must have experience in Git, Python, 5G. Preferred certification Cisco CCNP."
J1165,Junior Software Engineer,Cairocloud Group,Alexandria,Software,Senior,12,"Computer Vision, Numpy, Firewalls, Sql",AWS Certified Developer,2025-10-12,https//example.com/jobs/265,"Looking for a Senior Software Engineer to join CairoCloud. Must have experience in Computer Vision, NumPy, Firewalls. Preferred certification AWS Certified Developer."
J1166,Senior Systems Administrator,Alex Tech Ltd,Alexandria,Network,Lead,11,"Switching, Nosql, Hipaa, Nlp, Aws, Iso27001, Python",Google Professional Data Engineer,2025-10-10,https//example.com/jobs/266,"Looking for a Lead Systems Administrator to join ALEX Tech. Must have experience in Switching, NoSQL, HIPAA. Preferred certification Google Professional Data Engineer."
