job_id,job_title,company,location,department,job_level,required_experience_years,required_skills,preferred_certificates,date_posted,job_url,job_description
J0368,Senior Database Administrator,Techsol Egypt Ltd,Hurghada,Data,Mid,7,"Javascript, Kubernetes, Linux, Tensorflow, Tcp/Ip, Elasticsearch, Python, Docker",Certified Information Systems Security Professional (CISSP),2025-09-28,https//example.com/jobs/68,"Looking for a Mid Database Administrator to join TechSol Egypt. Must have experience in JavaScript, Kubernetes, Linux. Preferred certification Certified Information Systems Security Professional (CISSP)."
J0369,Mid-Level Software Engineer,Masrsoft Solutions,Hurghada,Software,Senior,10,"Python, Hipaa, Spark, Node.Js, Aws, Flask, Ci/Cd, React",AWS Certified Developer,2025-11-01,https//example.com/jobs/69,"Looking for a Senior Software Engineer to join MasrSoft. Must have experience in Python, HIPAA, Spark. Preferred certification AWS Certified Developer."
J0370,Lead Machine Learning Engineer,Smartdata Labs Inc,Mansoura,AI,Mid,4,"Git, Firewalls, Azure, Ci/Cd, Pytorch, Pandas, Kubernetes, Docker",Huawei HCIP,2025-11-18,https//example.com/jobs/70,"Looking for a Mid Machine Learning Engineer to join SmartData Labs. Must have experience in Git, Firewalls, Azure. Preferred certification Huawei HCIP."
J0371,Principal Quality Assurance Engineer,Pyramid Solutions Solutions,Alexandria,Software,Senior,10,"5G, Microservices, Linux, Python, Tcp/Ip, Routing, Node.Js",Certified Information Systems Security Professional (CISSP),2025-11-15,https//example.com/jobs/71,"Looking for a Senior Quality Assurance Engineer to join Pyramid Solutions. Must have experience in 5G, Microservices, Linux. Preferred certification Certified Information Systems Security Professional (CISSP)."
J0372,Junior Machine Learning Engineer,Smartdata Labs Solutions,Suez,AI,Junior,7,"Switching, Docker, Azure, Pandas, Aws, Spark",AWS Certified Solutions Architect,2025-10-11,https//example.com/jobs/72,"Looking for a Junior Machine Learning Engineer to join SmartData Labs. Must have experience in Switching, Docker, Azure. Preferred certification AWS Certified Solutions Architect."
J0373,Principal Product Manager,Futurevision Solutions,Aswan,Software,Mid,2,"C, Tensorflow, Microservices, 5G, Django, Elasticsearch, Docker, React",AWS Certified Developer,2025-10-24,https//example.com/jobs/73,"Looking for a Mid Product Manager to join FutureVision. Must have experience in C, TensorFlow, Microservices. Preferred certification AWS Certified Developer."
J0374,Senior Business Analyst,Techsol Egypt Egypt,Alexandria,Data,Mid,4,"Git, Gcp, 5G, Kubernetes, Aws",Google Professional Data Engineer,2025-11-01,https//example.com/jobs/74,"Looking for a Mid Business Analyst to join TechSol Egypt. Must have experience in Git, GCP, 5G. Preferred certification Google Professional Data Engineer."
J0375,Mid-Level Frontend Developer,Alex Tech Ltd,Aswan,Software,Lead,12,"C, React, Azure, Tcp/Ip, Aws, Node.Js, Hadoop",AWS Certified Developer,2025-11-08,https//example.com/jobs/75,"Looking for a Lead Frontend Developer to join ALEX Tech. Must have experience in C, React, Azure. Preferred certification AWS Certified Developer."
J0376,Junior Full Stack Developer,Smartdata Labs Egypt,Alexandria,Software,Mid,1,"Switching, Javascript, Tcp/Ip, Aws, Sql",Cisco CCNP,2025-10-14,https//example.com/jobs/76,"Looking for a Mid Full Stack Developer to join SmartData Labs. Must have experience in Switching, JavaScript, TCP/IP. Preferred certification Cisco CCNP."
J0377,Principal Database Administrator,Cairocloud Solutions,Hurghada,Data,Mid,5,"Nosql, Node.Js, Pandas, Azure, Kubernetes, React, Tensorflow",Certified Information Systems Security Professional (CISSP),2025-11-18,https//example.com/jobs/77,"Looking for a Mid Database Administrator to join CairoCloud. Must have experience in NoSQL, Node.js, Pandas. Preferred certification Certified Information Systems Security Professional (CISSP)."
J0378,Junior Embedded Systems Engineer,Cairocloud Group,Hurghada,Network,Mid,6,"Gcp, Python, Ci/Cd, Tcp/Ip, Sql, React",Certified Information Systems Security Professional (CISSP),2025-11-20,https//example.com/jobs/78,"Looking for a Mid Embedded Systems Engineer to join CairoCloud. Must have experience in GCP, Python, CI/CD. Preferred certification Certified Information Systems Security Professional (CISSP)."
J0379,Lead Devops Engineer,Deltabyte Egypt,Mansoura,Cloud/DevOps,Mid,7,"Ci/Cd, Routing, Docker, Pandas, Git, Kubernetes",AWS Certified Developer,2025-10-06,https//example.com/jobs/79,"Looking for a Mid DevOps Engineer to join DeltaByte. Must have experience in CI/CD, Routing, Docker. Preferred certification AWS Certified Developer."
J0380,Mid-Level Cybersecurity Analyst,Deltabyte Group,Tanta,Other,Mid,6,"Numpy, Linux, Python, Sql, Tensorflow",AWS Certified Solutions Architect,2025-11-18,https//example.com/jobs/80,"Looking for a Mid Cybersecurity Analyst to join DeltaByte. Must have experience in NumPy, Linux, Python. Preferred certification AWS Certified Solutions Architect."
J0381,Mid-Level Quality Assurance Engineer,Futurevision Ltd,Suez,Software,Senior,9,"Nlp, Aws, Docker, Gcp",Huawei HCIA,2025-10-31,https//example.com/jobs/81,"Looking for a Senior Quality Assurance Engineer to join FutureVision. Must have experience in NLP, AWS, Docker. Preferred certification Huawei HCIA."
J0382,Mid-Level Full Stack Developer,Masrsoft Inc,Cairo,Software,Junior,10,"Firewalls, Computer Vision, Tensorflow, Python",AWS Certified Developer,2025-11-18,https//example.com/jobs/82,"Looking for a Junior Full Stack Developer to join MasrSoft. Must have experience in Firewalls, Computer Vision, TensorFlow. Preferred certification AWS Certified Developer."
J0383,Principal Systems Administrator,Alex Tech Solutions,Aswan,Network,Junior,3,"Computer Vision, Ansible, Microservices, Linux, Sql, Gcp, Git, Tensorflow, Aws, Kubernetes",Cisco CCNA,2025-11-07,https//example.com/jobs/83,"Looking for a Junior Systems Administrator to join ALEX Tech. Must have experience in Computer Vision, Ansible, Microservices. Preferred certification Cisco CCNA."
J0384,Senior Cloud Engineer,Cloudworks Egypt Egypt,Giza,Cloud/DevOps,Mid,3,"Aws, Numpy, Hipaa, Computer Vision, Node.Js",AWS Certified Developer,2025-11-10,https//example.com/jobs/84,"Looking for a Mid Cloud Engineer to join CloudWorks Egypt. Must have experience in AWS, NumPy, HIPAA. Preferred certification AWS Certified Developer."
J0385,Junior Cybersecurity Analyst,Techsol Egypt Ltd,Mansoura,Other,Mid,10,"Gcp, Firewalls, Pandas, Computer Vision, Django, Python",Huawei HCIP,2025-10-21,https//example.com/jobs/85,"Looking for a Mid Cybersecurity Analyst to join TechSol Egypt. Must have experience in GCP, Firewalls, Pandas. Preferred certification Huawei HCIP."
J0386,Mid-Level Software Engineer,Deltabyte Egypt,Tanta,Software,Senior,7,"Ci/Cd, Routing, Spark, Sql, Tensorflow, Python",AWS Certified Developer,2025-09-29,https//example.com/jobs/86,"Looking for a Senior Software Engineer to join DeltaByte. Must have experience in CI/CD, Routing, Spark. Preferred certification AWS Certified Developer."
J0387,Senior Backend Developer,Techsol Egypt Solutions,Mansoura,Software,Lead,7,"Azure, Terraform, Tensorflow, Aws",Google Professional Data Engineer,2025-10-20,https//example.com/jobs/87,"Looking for a Lead Backend Developer to join TechSol Egypt. Must have experience in Azure, Terraform, TensorFlow. Preferred certification Google Professional Data Engineer."
J0388,Lead Devops Engineer,Masrsoft Group,Aswan,Cloud/DevOps,Mid,5,"Django, Rest Apis, Spark, Linux, C, Computer Vision, Python",Huawei HCIP,2025-10-19,https//example.com/jobs/88,"Looking for a Mid DevOps Engineer to join MasrSoft. Must have experience in Django, REST APIs, Spark. Preferred certification Huawei HCIP."
J0389,Lead Business Analyst,Delta Systems Ltd,Tanta,Data,Junior,8,"Nlp, Javascript, Numpy, Linux, Docker, Flask, Ci/Cd, Sql, Kubernetes, React",AWS Certified Developer,2025-11-02,https//example.com/jobs/89,"Looking for a Junior Business Analyst to join Delta Systems. Must have experience in NLP, JavaScript, NumPy. Preferred certification AWS Certified Developer."
J0390,Principal Data Analyst,Masrsoft Egypt,Cairo,Data,Junior,8,"Tensorflow, Iso27001, Kubernetes, React",Not Specified,2025-10-04,https//example.com/jobs/90,"Looking for a Junior Data Analyst to join MasrSoft. Must have experience in TensorFlow, ISO27001, Kubernetes. Preferred certification not required."
J0391,Principal Embedded Systems Engineer,Delta Systems Group,Hurghada,Network,Junior,5,"Python, Linux, Pytorch, Tensorflow, Gcp, Nosql, Flask, Kubernetes, Aws",AWS Certified Solutions Architect,2025-09-29,https//example.com/jobs/91,"Looking for a Junior Embedded Systems Engineer to join Delta Systems. Must have experience in Python, Linux, PyTorch. Preferred certification AWS Certified Solutions Architect."
J0392,Principal Software Engineer,Alex Tech Ltd,Hurghada,Software,Mid,2,"Gcp, Javascript, Tensorflow, Spark",Not Specified,2025-09-28,https//example.com/jobs/92,"Looking for a Mid Software Engineer to join ALEX Tech. Must have experience in GCP, JavaScript, TensorFlow. Preferred certification not required."
J0393,Mid-Level Frontend Developer,Smartdata Labs Inc,Suez,Software,Senior,8,"Microservices, Aws, C, Ansible, Routing, Ci/Cd",AWS Certified Solutions Architect,2025-09-24,https//example.com/jobs/93,"Looking for a Senior Frontend Developer to join SmartData Labs. Must have experience in Microservices, AWS, C. Preferred certification AWS Certified Solutions Architect."
J0394,Lead Product Manager,Giza Networks Group,Aswan,Software,Mid,7,"React, Node.Js, Switching, Pytorch, Firewalls, Tensorflow",Cisco CCNA,2025-10-30,https//example.com/jobs/94,"Looking for a Mid Product Manager to join Giza Networks. Must have experience in React, Node.js, Switching. Preferred certification Cisco CCNA."
J0395,Mid-Level Embedded Systems Engineer,Pyramid Solutions Group,Tanta,Network,Mid,5,"Microservices, Hadoop, Django, Flask, Kubernetes, Iso27001, React",Certified Information Systems Security Professional (CISSP),2025-11-16,https//example.com/jobs/95,"Looking for a Mid Embedded Systems Engineer to join Pyramid Solutions. Must have experience in Microservices, Hadoop, Django. Preferred certification Certified Information Systems Security Professional (CISSP)."
J0396,Junior Ai Researcher,Giza Networks Ltd,Tanta,AI,Senior,12,"Django, Switching, Hadoop, Iso27001, Gcp, Computer Vision, Tensorflow",Huawei HCIA,2025-11-03,https//example.com/jobs/96,"Looking for a Senior AI Researcher to join Giza Networks. Must have experience in Django, Switching, Hadoop. Preferred certification Huawei HCIA."
J0397,Mid-Level Product Manager,Nilesoft Solutions,Giza,Software,Senior,6,"Django, Computer Vision, Tensorflow, Javascript, 5G, Flask, Sql",Google Professional Data Engineer,2025-10-13,https//example.com/jobs/97,"Looking for a Senior Product Manager to join NileSoft. Must have experience in Django, Computer Vision, TensorFlow. Preferred certification Google Professional Data Engineer."
J0398,Mid-Level Database Administrator,Futurevision Egypt,Cairo,Data,Lead,10,"Django, Iso27001, Microservices, Kubernetes, Pytorch, Python",Certified Information Systems Security Professional (CISSP),2025-10-05,https//example.com/jobs/98,"Looking for a Lead Database Administrator to join FutureVision. Must have experience in Django, ISO27001, Microservices. Preferred certification Certified Information Systems Security Professional (CISSP)."
J0399,Principal Full Stack Developer,Alex Tech Egypt,Tanta,Software,Junior,6,"Aws, Hadoop, Hipaa, Java, Linux, Terraform, Nosql, Tensorflow, Node.Js",Cisco CCNA,2025-11-04,https//example.com/jobs/99,"Looking for a Junior Full Stack Developer to join ALEX Tech. Must have experience in AWS, Hadoop, HIPAA. Preferred certification Cisco CCNA."
J0400,Junior Systems Administrator,Alex Tech Ltd,Tanta,Network,Intern,0,"Iso27001, Numpy, React, Pytorch",AWS Certified Solutions Architect,2025-09-26,https//example.com/jobs/100,"Looking for a Intern Systems Administrator to join ALEX Tech. Must have experience in ISO27001, NumPy, React. Preferred certification AWS Certified Solutions Architect."
J0401,Lead It Support Engineer,Delta Systems Ltd,Aswan,Cloud/DevOps,Mid,5,"Computer Vision, Routing, Switching, Iso27001",AWS Certified Developer,2025-11-16,https//example.com/jobs/101,"Looking for a Mid IT Support Engineer to join Delta Systems. Must have experience in Computer Vision, Routing, Switching. Preferred certification AWS Certified Developer."
J0402,Lead Backend Developer,Cairocloud Egypt,Alexandria,Software,Senior,4,"Linux, Elasticsearch, Hadoop",Certified Information Systems Security Professional (CISSP),2025-10-29,https//example.com/jobs/102,"Looking for a Senior Backend Developer to join CairoCloud. Must have experience in Linux, ElasticSearch, Hadoop. Preferred certification Certified Information Systems Security Professional (CISSP)."
J0403,Senior Business Analyst,Giza Networks Ltd,Mansoura,Data,Junior,2,"Hadoop, Flask, Tcp/Ip, Firewalls, Rest Apis, Python, Tensorflow, React",Not Specified,2025-11-02,https//example.com/jobs/103,"Looking for a Junior Business Analyst to join Giza Networks. Must have experience in Hadoop, Flask, TCP/IP. Preferred certification not required."
J0404,Senior Systems Administrator,Techsol Egypt Solutions,Hurghada,Network,Mid,3,"Kubernetes, Routing, Tensorflow, Aws, Node.Js",Cisco CCNA,2025-10-09,https//example.com/jobs/104,"Looking for a Mid Systems Administrator to join TechSol Egypt. Must have experience in Kubernetes, Routing, TensorFlow. Preferred certification Cisco CCNA."
J0405,Lead Cloud Engineer,Nilesoft Ltd,Cairo,Cloud/DevOps,Mid,8,"Tensorflow, Pandas, Terraform, Aws, Sql, Docker",Not Specified,2025-10-26,https//example.com/jobs/105,"Looking for a Mid Cloud Engineer to join NileSoft. Must have experience in TensorFlow, Pandas, Terraform. Preferred certification not required."
J0406,Lead Devops Engineer,Nilesoft Inc,Aswan,Cloud/DevOps,Senior,5,"Java, Ci/Cd, React, Switching, Hadoop, Numpy, Tensorflow, Python",Google Professional Data Engineer,2025-10-09,https//example.com/jobs/106,"Looking for a Senior DevOps Engineer to join NileSoft. Must have experience in Java, CI/CD, React. Preferred certification Google Professional Data Engineer."
J0407,Mid-Level Full Stack Developer,Giza Networks Solutions,Cairo,Software,Lead,6,"Ci/Cd, Computer Vision, Node.Js, Hadoop, Django, Azure, Terraform, Kubernetes, Aws",Google Professional Data Engineer,2025-10-24,https//example.com/jobs/107,"Looking for a Lead Full Stack Developer to join Giza Networks. Must have experience in CI/CD, Computer Vision, Node.js. Preferred certification Google Professional Data Engineer."
J0408,Mid-Level Frontend Developer,Giza Networks Egypt,Mansoura,Software,Senior,9,"Sql, React, Microservices, Flask, Ansible, Aws, Node.Js",Not Specified,2025-10-03,https//example.com/jobs/108,"Looking for a Senior Frontend Developer to join Giza Networks. Must have experience in SQL, React, Microservices. Preferred certification not required."
J0409,Principal Devops Engineer,Alex Tech Ltd,Alexandria,Cloud/DevOps,Junior,4,"Docker, Nosql, Pytorch, React, Rest Apis",Certified Information Systems Security Professional (CISSP),2025-11-08,https//example.com/jobs/109,"Looking for a Junior DevOps Engineer to join ALEX Tech. Must have experience in Docker, NoSQL, PyTorch. Preferred certification Certified Information Systems Security Professional (CISSP)."
J0410,Senior Embedded Systems Engineer,Cloudworks Egypt Solutions,Suez,Network,Mid,5,"Pytorch, Elasticsearch, React, Git, Routing, Docker, Kubernetes, Node.Js",Cisco CCNA,2025-10-28,https//example.com/jobs/110,"Looking for a Mid Embedded Systems Engineer to join CloudWorks Egypt. Must have experience in PyTorch, ElasticSearch, React. Preferred certification Cisco CCNA."
J0411,Principal Backend Developer,Alex Tech Ltd,Giza,Software,Junior,9,"Javascript, Computer Vision, Tcp/Ip, Docker",AWS Certified Developer,2025-11-01,https//example.com/jobs/111,"Looking for a Junior Backend Developer to join ALEX Tech. Must have experience in JavaScript, Computer Vision, TCP/IP. Preferred certification AWS Certified Developer."
J0412,Lead Frontend Developer,Deltabyte Ltd,Aswan,Software,Mid,2,"Iso27001, Docker, Switching, Git, Microservices, Pytorch, Node.Js",AWS Certified Solutions Architect,2025-10-19,https//example.com/jobs/112,"Looking for a Mid Frontend Developer to join DeltaByte. Must have experience in ISO27001, Docker, Switching. Preferred certification AWS Certified Solutions Architect."
J0413,Principal Full Stack Developer,Cloudworks Egypt Solutions,Tanta,Software,Lead,7,"Nosql, C, Azure, Elasticsearch, Terraform, Sql, Computer Vision",Cisco CCNP,2025-11-18,https//example.com/jobs/113,"Looking for a Lead Full Stack Developer to join CloudWorks Egypt. Must have experience in NoSQL, C, Azure. Preferred certification Cisco CCNP."
J0414,Senior Systems Administrator,Giza Networks Egypt,Aswan,Network,Senior,5,"React, 5G, Django, Hipaa, Pandas",Cisco CCNA,2025-10-07,https//example.com/jobs/114,"Looking for a Senior Systems Administrator to join Giza Networks. Must have experience in React, 5G, Django. Preferred certification Cisco CCNA."
J0415,Mid-Level Quality Assurance Engineer,Cairocloud Ltd,Tanta,Software,Junior,2,"Routing, Numpy, Tensorflow, Node.Js, Hipaa",Google Professional Data Engineer,2025-11-01,https//example.com/jobs/115,"Looking for a Junior Quality Assurance Engineer to join CairoCloud. Must have experience in Routing, NumPy, TensorFlow. Preferred certification Google Professional Data Engineer."
J0416,Lead Cloud Engineer,Cairocloud Ltd,Giza,Cloud/DevOps,Mid,6,"Computer Vision, Java, Firewalls, Routing, Nosql, Kubernetes, 5G, Sql, React",Certified Information Systems Security Professional (CISSP),2025-10-03,https//example.com/jobs/116,"Looking for a Mid Cloud Engineer to join CairoCloud. Must have experience in Computer Vision, Java, Firewalls. Preferred certification Certified Information Systems Security Professional (CISSP)."
J0417,Senior Ai Researcher,Cairocloud Inc,Alexandria,AI,Junior,3,"Terraform, Ansible, C, 5G, Tensorflow, Pandas, Pytorch, Aws, Kubernetes",Huawei HCIA,2025-10-02,https//example.com/jobs/117,"Looking for a Junior AI Researcher to join CairoCloud. Must have experience in Terraform, Ansible, C. Preferred certification Huawei HCIA."
J0418,Junior Quality Assurance Engineer,Cloudworks Egypt Ltd,Alexandria,Software,Senior,4,"Computer Vision, Azure, Elasticsearch, Tcp/Ip, Hipaa, Aws, Node.Js, Python",Not Specified,2025-10-06,https//example.com/jobs/118,"Looking for a Senior Quality Assurance Engineer to join CloudWorks Egypt. Must have experience in Computer Vision, Azure, ElasticSearch. Preferred certification not required."
J0419,Junior Systems Administrator,Cloudworks Egypt Solutions,Suez,Network,Senior,9,"Iso27001, Elasticsearch, Ci/Cd, Tcp/Ip, Pandas, Aws, Tensorflow, React",Not Specified,2025-10-24,https//example.com/jobs/119,"Looking for a Senior Systems Administrator to join CloudWorks Egypt. Must have experience in ISO27001, ElasticSearch, CI/CD. Preferred certification not required."
J0420,Junior Database Administrator,Cairocloud Egypt,Hurghada,Data,Senior,6,"Javascript, Git, Computer Vision, Hipaa, Django",Not Specified,2025-11-14,https//example.com/jobs/120,"Looking for a Senior Database Administrator to join CairoCloud. Must have experience in JavaScript, Git, Computer Vision. Preferred certification not required."
J0421,Senior Full Stack Developer,Pharos Ai Egypt,Giza,Software,Senior,8,"Microservices, Pytorch, Hadoop, Node.Js, Aws, Elasticsearch, Sql",Cisco CCNP,2025-11-19,https//example.com/jobs/121,"Looking for a Senior Full Stack Developer to join Pharos AI. Must have experience in Microservices, PyTorch, Hadoop. Preferred certification Cisco CCNP."
J0422,Mid-Level Software Engineer,Giza Networks Ltd,Cairo,Software,Mid,5,"Pandas, Node.Js, Computer Vision, Aws",AWS Certified Solutions Architect,2025-10-11,https//example.com/jobs/122,"Looking for a Mid Software Engineer to join Giza Networks. Must have experience in Pandas, Node.js, Computer Vision. Preferred certification AWS Certified Solutions Architect."
J0423,Lead Full Stack Developer,Futurevision Inc,Tanta,Software,Senior,6,"Tcp/Ip, Git, Tensorflow, Aws",Certified Information Systems Security Professional (CISSP),2025-10-19,https//example.com/jobs/123,"Looking for a Senior Full Stack Developer to join FutureVision. Must have experience in TCP/IP, Git, TensorFlow. Preferred certification Certified Information Systems Security Professional (CISSP)."
J0424,Lead Quality Assurance Engineer,Techsol Egypt Group,Giza,Software,Intern,0,"Pytorch, Hipaa, Ansible, Hadoop, Docker, React",AWS Certified Developer,2025-11-09,https//example.com/jobs/124,"Looking for a Intern Quality Assurance Engineer to join TechSol Egypt. Must have experience in PyTorch, HIPAA, Ansible. Preferred certification AWS Certified Developer."
J0425,Senior Systems Administrator,Delta Systems Inc,Mansoura,Network,Junior,4,"Ci/Cd, React, Flask, Rest Apis, Java, Microservices",Huawei HCIP,2025-11-05,https//example.com/jobs/125,"Looking for a Junior Systems Administrator to join Delta Systems. Must have experience in CI/CD, React, Flask. Preferred certification Huawei HCIP."
J0426,Lead Machine Learning Engineer,Pharos Ai Solutions,Aswan,AI,Intern,2,"Azure, Iso27001, Spark, Nosql, Node.Js, Kubernetes, Python, Sql",Not Specified,2025-10-14,https//example.com/jobs/126,"Looking for a Intern Machine Learning Engineer to join Pharos AI. Must have experience in Azure, ISO27001, Spark. Preferred certification not required."
J0427,Principal Frontend Developer,Pyramid Solutions Ltd,Cairo,Software,Mid,8,"Pandas, Computer Vision, Gcp",AWS Certified Solutions Architect,2025-10-13,https//example.com/jobs/127,"Looking for a Mid Frontend Developer to join Pyramid Solutions. Must have experience in Pandas, Computer Vision, GCP. Preferred certification AWS Certified Solutions Architect."
J0428,Mid-Level Frontend Developer,Alex Tech Egypt,Hurghada,Software,Senior,6,"5G, Tensorflow, C, Nlp, Firewalls, Nosql, Ci/Cd, Kubernetes",Certified Information Systems Security Professional (CISSP),2025-10-31,https//example.com/jobs/128,"Looking for a Senior Frontend Developer to join ALEX Tech. Must have experience in 5G, TensorFlow, C. Preferred certification Certified Information Systems Security Professional (CISSP)."
J0429,Mid-Level Data Scientist,Cloudworks Egypt Egypt,Alexandria,AI,Junior,9,"Tcp/Ip, Docker, C, Tensorflow, Node.Js",Huawei HCIP,2025-11-16,https//example.com/jobs/129,"Looking for a Junior Data Scientist to join CloudWorks Egypt. Must have experience in TCP/IP, Docker, C. Preferred certification Huawei HCIP."
J0430,Lead Backend Developer,Alex Tech Ltd,Mansoura,Software,Mid,7,"C, Docker, Tcp/Ip, Nlp, Javascript, Aws, Python",Cisco CCNP,2025-10-08,https//example.com/jobs/130,"Looking for a Mid Backend Developer to join ALEX Tech. Must have experience in C, Docker, TCP/IP. Preferred certification Cisco CCNP."
J0431,Senior Full Stack Developer,Cloudworks Egypt Egypt,Tanta,Software,Mid,8,"Pandas, 5G, Nosql, Rest Apis, Terraform, Computer Vision, Aws",Not Specified,2025-10-08,https//example.com/jobs/131,"Looking for a Mid Full Stack Developer to join CloudWorks Egypt. Must have experience in Pandas, 5G, NoSQL. Preferred certification not required."
J0432,Senior Frontend Developer,Futurevision Inc,Aswan,Software,Junior,5,"Tcp/Ip, Switching, Django, Node.Js, Iso27001, Firewalls, Routing, Aws, React, Tensorflow",Certified Information Systems Security Professional (CISSP),2025-10-29,https//example.com/jobs/132,"Looking for a Junior Frontend Developer to join FutureVision. Must have experience in TCP/IP, Switching, Django. Preferred certification Certified Information Systems Security Professional (CISSP)."
J0433,Mid-Level Database Administrator,Cairocloud Inc,Suez,Data,Mid,2,"Hadoop, Linux, Javascript, React, Numpy, Sql",Cisco CCNP,2025-10-23,https//example.com/jobs/133,"Looking for a Mid Database Administrator to join CairoCloud. Must have experience in Hadoop, Linux, JavaScript. Preferred certification Cisco CCNP."
J0434,Mid-Level Data Scientist,Techsol Egypt Inc,Alexandria,AI,Senior,11,"Tensorflow, React, Azure, Docker, Node.Js",Cisco CCNP,2025-10-14,https//example.com/jobs/134,"Looking for a Senior Data Scientist to join TechSol Egypt. Must have experience in TensorFlow, React, Azure. Preferred certification Cisco CCNP."
J0435,Principal Cybersecurity Analyst,Deltabyte Inc,Cairo,Other,Mid,8,"Computer Vision, Elasticsearch, React, Iso27001, Tensorflow, Kubernetes, Node.Js, Docker",Not Specified,2025-10-14,https//example.com/jobs/135,"Looking for a Mid Cybersecurity Analyst to join DeltaByte. Must have experience in Computer Vision, ElasticSearch, React. Preferred certification not required."
J0436,Senior Cybersecurity Analyst,Alex Tech Egypt,Mansoura,Other,Junior,4,"Nosql, Rest Apis, Ansible, Kubernetes, Aws, Node.Js",Google Professional Data Engineer,2025-11-18,https//example.com/jobs/136,"Looking for a Junior Cybersecurity Analyst to join ALEX Tech. Must have experience in NoSQL, REST APIs, Ansible. Preferred certification Google Professional Data Engineer."
J0437,Senior Mobile Developer,Nilesoft Inc,Mansoura,Software,Senior,14,"Tcp/Ip, Rest Apis, Docker, Flask, Kubernetes, Tensorflow, Sql",Huawei HCIA,2025-11-14,https//example.com/jobs/137,"Looking for a Senior Mobile Developer to join NileSoft. Must have experience in TCP/IP, REST APIs, Docker. Preferred certification Huawei HCIA."
J0438,Mid-Level Frontend Developer,Smartdata Labs Inc,Alexandria,Software,Senior,12,"Switching, Nlp, React, Aws, Tensorflow",Not Specified,2025-10-25,https//example.com/jobs/138,"Looking for a Senior Frontend Developer to join SmartData Labs. Must have experience in Switching, NLP, React. Preferred certification not required."
